<?xml version="1.0" encoding="UTF-8"?>
<?xml-stylesheet href="../xsl/master.xsl" type="text/xsl" media="screen"?>
<!DOCTYPE masterInfo SYSTEM "../dtd/master.dtd">

<master>
	<parcours annee="SIS">
		<presentation>
			<refprof id="isabel.demongodin"/>
			<description>
				<paragraphe>Cette spécialité à finalité professionnelle est une composante du Master <b>Informatique</b> et du Master <b>Image et Systèmes</b>. Elle est déclinée en trois <b>parcours</b> mais un seul est disponible dans la mention <b>Informatique</b>. Consulter ce parcours pour avoir une information plus précise :</paragraphe>
				<liste>
					<el>Parcours Informatique</el>
				</liste>
			</description>
		</presentation>
	</parcours>
</master>