<?xml version="1.0" encoding="UTF-8"?>
<?xml-stylesheet href="../xsl/master.xsl" type="text/xsl" media="screen"?>
<!DOCTYPE masterInfo SYSTEM "../dtd/master.dtd">

<master>
	&menu;
	<parcours annee="ISL">
		<presentation>
			<refprof id="jean-luc.massat"/>
			<lieu>
				<campus>Campus de Luminy</campus>
			</lieu>
			<description>
				<paragraphe>Le développement de l'Internet/Intranet et des applications associées a fait émerger de nouvelles normes pour la structuration des applications informatiques réparties. L'enjeu est de présenter des modèles (programmation par composants, par aspects, design pattern), des plateformes (JEE, .NET, Corba, etc.) et des outils (JAVA, SGBDOO, XML) qui offrent un cadre dans lequel les applications sont développées, validées et intégrées plus facilement.</paragraphe>
				<paragraphe>L'objectif de ce parcours est d'initier les étudiants à la conception et à la réalisation d'applications dans de tels cadres. La formation mettra plus particulièrement l'accent sur les notions d'architecture logicielle, de programmation par composants, de qualité et de fiabilité. Elle utilisera la plateforme Java Enterprise Edition pour concrétiser les concepts présentés.</paragraphe>
			</description>
		</presentation>
		<competences>
			<liste>
				<el>spécifier, concevoir, réaliser et déployer des applications réparties,</el>
				<el>proposer des architectures informatiques complexes,</el>
				<el>mettre en œuvre des plateformes informatiques professionnelles (JEE, frameworks, etc.),</el>
				<el>synthétiser et présenter une problématique métier (CdC, spécifications, recette, politique de test),</el>
				<el>communiquer en Anglais et en Français.</el>
			</liste>
		</competences>
		<connaissances>
			<paragraphe>L'objectif de la spécialité FSIL est de former des étudiants afin qu'ils puissent concevoir, réaliser, valider et mettre en exploitation des logiciels. Pour ce faire, ils devront connaître les concepts, les outils et les méthodes liés au développement de logiciels. Les aspects de qualité, de sécurité et de bonne intégration dans des environnements informatiques complexes seront les points forts de la formation.</paragraphe>
		</connaissances>
		<programme semestre="3">
			<paquet_unites>
				<nom>TC des parcours FSI et ISL</nom>
				<refunite id="ENSINCU27"/>
				<refunite id="ENSINCU28"/>
				<refunite id="ENSINCU29"/>
				<refunite id="ENSINCU30"/>
				<refunite id="ENSINCU31"/>
			</paquet_unites>
			<paquet_unites>
				<nom>Unité d'enseignement à bonus</nom>
				<refunite id="ENSINCU67"/>
			</paquet_unites>
			<paquet_unites>
				<nom>Unités obligatoires </nom>
				<refunite id="ENSINCU36"/>
				<refunite id="ENSINCU37"/>
				<refunite id="ENSINCU38"/>
				<refunite id="ENSINCU39"/>
				<refunite id="ENSINCU40"/>
			</paquet_unites>
		</programme>
		<programme semestre="4">
			<paquet_unites>
				<nom>Unités obligatoires </nom>
				<refunite id="ENSINDU3"/>
				<refunite id="ENSINDU4"/>
			</paquet_unites>
		</programme>
		<politique_des_stages>
			<paragraphe>La formation par le biais des projets est largement encouragée : la deuxième année se clôture par un projet de huit semaines en groupe de cinq à six étudiants. C'est l'occasion de mettre en pratique les connaissances acquises durant la formation.</paragraphe>
			<paragraphe>Les stages sont obligatoires en deuxième année (5 à 6 mois). Ils se déroulent en entreprise ou dans un laboratoire suivant les objectifs professionnels de l'étudiant. La recherche de stage est assurée par l'étudiant avec l'aide de l'équipe pédagogique (liste d'entreprises, diffusion des offres reçues, etc.). Le sujet de stage est validé par un enseignant responsable avant la signature de la convention. La fin du stage donne lieu à une soutenance et à la rédaction d 'un mémoire.</paragraphe>
		</politique_des_stages>
		<aspects_formation>
			<paragraphe>Les membres de l'équipe pédagogique ont une expérience importante en ce qui concerne l'enseignement des bases de données et des applications réparties objets. La plupart des cours spécifiques de ce parcours sont déjà proposés aux étudiants dans le cadre des diplômes actuels depuis plus de 10 ans et régulièrement mis à jour.</paragraphe>
		</aspects_formation>
		<modalites_pedagogiques>
			<liste>
				<paragraphe>L'organisation des enseignements est destinée à renforcer tous les aspects professionnels de la formation. On peut citer notamment :</paragraphe>
				<el>le travail en petit groupe et l'évaluation à base de projets,</el>
				<el>la mise en situation de responsabilité (gestion du parc d'ordinateurs par les étudiants, projet de fin d'année géré directement par les étudiants),</el>
				<el>les nombreux documents à rédiger durant les enseignements,</el>
				<el>les nombreuses présentations orales à effectuer,</el>
				<el>les enseignements spécifiques en Anglais (préparation et passage du TOEIC) et Communication (Lettre de motivation, CV, entretien d'embauche, règles de savoir-être),</el>
				<el>le contact avec des professionnels via les séminaires et les présentations d'entreprises.</el>
			</liste>
		</modalites_pedagogiques>
		<conditions_admission>
			<pre_requis type="obligatoires">
				<liste>
					<el>Être titulaire d'une première année de Master en informatique.</el>
					<el>Avoir de bonnes connaissances en bases de données, langages objets et génie logiciel.</el>
				</liste>
			</pre_requis>
			<pre_requis type="recommandés">
				<liste>
					<el>Avoir de bonnes connaissances en bases de données, langages objets et génie logiciel.</el>
				</liste>
			</pre_requis>
			<paragraphe>L'entrée en deuxième année se fait uniquement sur dossier. Une première année de Master à dominante informatique est requise (60 crédits). Tout autre diplôme de niveau équivalent sera également étudié. La deuxième année du Master est également accessible par le biais de la VAP et de la VAE.</paragraphe>
			<lien link="http://masterinfo.univ-mrs.fr/candidature/">Déposer une candidature pour 2014/2015.</lien>
		</conditions_admission>
		<debouches>
			<paragraphe>Les secteurs d'activités concernés sont tous ceux qui utilisent et développent des applications informatiques, avec des pré-requis forts de fiabilité (qualité logicielle) et sécurité (protection contre les actions malveillantes). Les SSII forment une part importante des débouchés mais de grands groupes de l'industrie (transports, électronique, défense,...) ou des services (banques, assurance,..) sont également des employeurs. Les PME innovantes en informatique (éditeurs, prestataires de services, ...) et les collectivités territoriales et établissements publics complètent le secteur d'activité.</paragraphe>
			<liste>
				<paragraphe>Métiers visés pour le parcours FSI :</paragraphe>
				<el>Ingénieur études et développement,</el>
				<el>Responsable réseaux,</el>
				<el>Responsable systèmes et sécurité,</el>
				<el>Ingénieur qualité.</el>
			</liste>
			<liste>
				<paragraphe>Métiers visés par le parcours ISL :</paragraphe>
				<el>Ingénieur études et développement,</el>
				<el>Architecte logiciel,</el>
				<el>Ingénieur en système d'information,</el>
				<el>Expert technique ou fonctionnel.</el>
			</liste>
		</debouches>
		<poursuites>
			<liste>
				<el>Un doctorat est envisageable à l'issue de la spécialité FSIL.</el>
				<el>Les diplômés ont également la possibilité de choisir des formations plus axées sur la gestion des projets scientifiques pourceux qui visent des postes à forte responsabilité.</el>
				<el>Il est également envisageable de suivre une autre spécialité du même master ou d'un autre pour enrichir son portefeuille de compétences.</el>
			</liste>
		</poursuites>
	</parcours>
</master>