<?xml version="1.0" encoding="UTF-8"?>
<?xml-stylesheet href="../xsl/master.xsl" type="text/xsl" media="screen"?>
<!DOCTYPE masterInfo SYSTEM "../dtd/master.dtd">

<master>
	&menu;
	<parcours annee="ID">
		<presentation>
			<refprof id="noel.novelli"/>
			<description>
				<liste>
					<paragraphe>Cette spécialité à finalité professionnelle est une composante du Master Informatique. Elle est déclinée en deux <b>parcours</b> qui partagent un tronc-commun au début de la deuxième année (semestre 3). Consultez ces deux parcours pour avoir une information plus précise :</paragraphe>
					<el>Fouille et entrepôts de données (FED)</el>
					<el>Recherche opérationnelle (RO)</el>
				</liste>
			</description>
		</presentation>
	</parcours>
</master>