<?xml version="1.0" encoding="UTF-8"?>
<?xml-stylesheet href="../xsl/master.xsl" type="text/xsl" media="screen"?>
<!DOCTYPE masterInfo SYSTEM "../dtd/master.dtd">

<master>
	&menu;
	<parcours annee="RIM">
		<presentation>
			<refprof id="frederic.bechet"/>
			<lieu>
				<campus>Campus de Luminy</campus>
			</lieu>
			<description>
				<paragraphe>L'objectif de la spécialité RIM est de former des spécialistes du traitement et de la recherche de contenus multimédias. Du point de vue des débouchés professionnels, cette formation vise à produire des informaticiens spécialistes du traitement des données multimédia et de la recherche d'information qui pourront s'intégrer dans des entreprises innovantes centrées autour des domaines du multimédia et de l'internet.</paragraphe>
			</description>
		</presentation>
		<competences>
			<paragraphe>Les enseignements sont organisés selon deux axes : l'analyse et la représentation du contenu d'une part ; l'indexation et la recherche d'information d'autre part. L'analyse et le traitement du contenu désignent les traitements de fichiers texte, audio, image ou vidéo permettant d'obtenir une représentation structurée de leur contenu sous forme de descripteurs, du niveau signal au niveau sémantique. L'indexation consiste à utiliser ces descripteurs afin d'indexer finement chaque document pour procéder à son archivage de façon optimisée.</paragraphe>
		</competences>
		<connaissances>
			<paragraphe>L'objectif de la spécialité RIM est de former des spécialistes du traitement et de la recherche de contenus multimédias sur internet. Les enseignements sont organisés selon deux axes : l'analyse et la représentation du contenu d'une part ; l'indexation et la recherche d'information d'autre part. L'analyse et le traitement du contenu désignent les traitements de fichiers texte, audio, image ou vidéo permettant d'obtenir une représentation structurée de leur contenu sous forme de descripteurs, du niveau signal au niveau sémantique.</paragraphe>
		</connaissances>
		<programme semestre="3">
			<paquet_unites>
				<nom>Unité d'enseignement à bonus</nom>
				<refunite id="ENSINCU67"/>
			</paquet_unites>
			<paquet_unites>
				<nom>Unités obligatoires</nom>
				<refunite id="ENSINCU56"/>
				<refunite id="ENSINCU58"/>
				<refunite id="ENSINCU59"/>
				<refunite id="ENSINCU66"/>
				<refunite id="ENSINCU69"/>
				<refunite id="ENSINCU27"/>
				<refunite id="ENSINCU28"/>
			</paquet_unites>
			<paquet_unites>
				<nom>3 crédits à choisir parmi </nom>
				<refunite id="ENSINCU4"/>
				<refunite id="ENSINCU5"/>
				<refunite id="ENSINCU6"/>
				<refunite id="ENSINCU7"/>
				<refunite id="ENSINCU19"/>
				<refunite id="ENSINCU20"/>
				<refunite id="ENSINCU21"/>
			</paquet_unites>
		</programme>
		<programme semestre="4">
			<paquet_unites>
				<nom>Unités obligatoires</nom>
				<refunite id="ENSINDU3"/>
				<refunite id="ENSINDU4"/>
			</paquet_unites>
		</programme>
		<politique_des_stages>
			<paragraphe>Les stages doivent être effectués soit dans une entreprise, soit dans un laboratoire de recherche ayant un lien fort avec la thématique de la spécialité. Les sujets des projets de fin d'étude pourront avoir été proposés par des professionnels, l'encadrement est réalisé par l'équipe pédagogique.</paragraphe>
		</politique_des_stages>
		<aspects_formation>
			<paragraphe>Cette spécialité repose sur les compétences de deux équipes du LIF : l'équipe TALEP qui apportera ses compétences dans le domaine du traitement des contenus textuels et audio et l'équipe Apprentissage Automatique qui apportera ses compétences dans le domaine de la classification et de l'annotation de données multimodales.</paragraphe>
		</aspects_formation>
		<modalites_pedagogiques>
			<paragraphe>Les enseignements seront partagés entre des cours et du travail pratique, soit TD soit TP, selon les matières. Une part importante du travail personnel sera consacrée à la réalisation de projets concrets, communs à plusieurs enseignements, représentant des cas d'études réalistes de prototypes de traitements de données multimédia.</paragraphe>
		</modalites_pedagogiques>
		<conditions_admission>
			<pre_requis type="obligatoires">
				<paragraphe>Une première année de Master informatique est requise (60 crédits). Tout autre diplôme de niveau équivalent sera également étudié (ainsi que VAP et VAE)</paragraphe>
			</pre_requis>
			<paragraphe>L'entrée en deuxième année se fait uniquement sur dossier. Une première année de Master informatique est requise (60 crédits). Tout autre diplôme de niveau équivalent sera également étudié (ainsi que VAP et VAE).</paragraphe>
			<lien link="http://masterinfo.univ-mrs.fr/candidature/">Déposer une candidature pour 2014/2015.</lien>
		</conditions_admission>
		<debouches>
			<paragraphe>Cette formation vise à produire des informaticiens spécialistes du traitement des données multimédia et de la recherche d'information qui pourront s'intégrer dans les entreprises innovantes centrées autour des domaines du multimédia et de l'internet.</paragraphe>
		</debouches>
		<poursuites>
			<paragraphe>Une poursuite en thèse pourra être envisagée si le stage de fin d'étude s'effectue au sein d'un laboratoire de recherche.</paragraphe>
		</poursuites>
	</parcours>
</master>