<?xml version="1.0" encoding="UTF-8"?>
<?xml-stylesheet href="../xsl/master.xsl" type="text/xsl" media="screen"?>
<!DOCTYPE masterInfo SYSTEM "../dtd/master.dtd">

<master>
	<parcours annee="IF">
		<presentation>
			<refprof id="hery-liva.ralaivola"/>
			<refprof id="pierre-alain.reynier"/>
			<lieu>
				<campus>Campus de Luminy</campus>
			</lieu>
			<description>
				<paragraphe>L'objectif de la spécialité Informatique Fondamentale est de donner des connaissances solides dans le domaine des fondements de l'informatique. Il s'agit d'acquérir des connaissances sur les concepts et les méthodes dans l es thèmes couverts par le Laboratoire d'Informatique Fondamentale.</paragraphe>
			</description>
		</presentation>
		<competences>
			<paragraphe>En termes de compétences cette spécialité a pour but de développer chez les étudiants leur capacité à raisonner et à for, et de les initier à la recherche.</paragraphe>
			<paragraphe>Cette spécialité de master a pour vocation de former des diplômés en informatique capables d'occuper des postes d'enseignant-chercheur ou de chercheur, ou tout poste lié à la recherche dans les organismes de recherche publics ou privés.</paragraphe>
		</competences>
		<connaissances>
			<paragraphe>L'objectif de la spécialité Informatique Fondamentale est de donner des connaissances solides dans le domaine des fondements de l'informatique.</paragraphe>
			<paragraphe>Il s'agit d'acquérir des connaissances sur les concepts et les méthodes dans les thèmes couverts par le laboratoire d'informatique fondamentale.</paragraphe>
		</connaissances>
		<programme semestre="3">
			<paquet_unites>
				<nom>Unités obligatoires</nom>
				<refunite id="ENSINCU1"/>
				<refunite id="ENSINCU2"/>
				<refunite id="ENSINCU3"/>
			</paquet_unites>
			<paquet_unites>
				<nom>15 crédits à choisir (validation requise)</nom>
				<refunite id="ENSINCU4"/>
				<refunite id="ENSINCU5"/>
				<refunite id="ENSINCU6"/>
				<refunite id="ENSINCU7"/>
				<refunite id="ENSINCU8"/>
				<refunite id="ENSINCU9"/>
				<refunite id="ENSINCU10"/>
				<refunite id="ENSINCU11"/>
				<refunite id="ENSINCU12"/>
				<refunite id="ENSINCU13"/>
				<refunite id="ENSINCU14"/>
				<refunite id="ENSINCU15"/>
				<refunite id="ENSINCU16"/>
				<refunite id="ENSINCU17"/>
				<refunite id="ENSINCU18"/>
				<refunite id="ENSINCU19"/>
				<refunite id="ENSINCU20"/>
				<refunite id="ENSINCU21"/>
				<refunite id="ENSINCU22"/>
				<refunite id="ENSINCU23"/>
				<refunite id="ENSINCU24"/>
				<refunite id="ENSINCU25"/>
				<refunite id="ENSINCU26"/>
			</paquet_unites>
		</programme>
		<programme semestre="4">
			<paquet_unites>
				<nom>Unités obligatoires</nom>
				<refunite id="ENSINDU1"/>
				<refunite id="ENSINDU2"/>
			</paquet_unites>
		</programme>
		<politique_des_stages>
			<paragraphe>Stage dans un laboratoire de recherche.</paragraphe>
		</politique_des_stages>
		<aspects_formation>
			<paragraphe>La formation est caractérisée par un ensemble de cours fondamentaux qui préparent aux UE optionnelles, pour lesquelles les étudiants peuvent choisir des cours plutôt à vocation recherche. Enfin, l'UE projet ou stage peut être dédiée complètement à la recherche : stage dans un laboratoire, ou projet à vocation recherche.</paragraphe>
		</aspects_formation>
		<enseignements_delocalises>
			<paragraphe>Ce master bénéficie de plusieurs contrats Erasmus. Ils permettent des échanges au niveau Master 1 et 2 (le plus souvent sur un semestre),puis au niveau doctoral.</paragraphe>
		</enseignements_delocalises>
		<conditions_admission>
			<pre_requis type="obligatoires">
				<paragraphe>M1 à dominante informatique.</paragraphe>
			</pre_requis>
			<paragraphe>L'entrée en deuxième année se fait uniquement sur dossier. Une première année de Master à dominante informatique est requise (60 crédits).</paragraphe>
			<lien link="http://masterinfo.univ-mrs.fr/candidature/">Déposer une candidature pour 2014/2015.</lien>
		</conditions_admission>
		<debouches>
			<paragraphe>Emplois recherche et développement dans des entreprises privées ou des établissements publics, ou emploi d'enseignant-chercheur pour les étudiants qui poursuivent en thèse.</paragraphe>
		</debouches>
		<poursuites>
			<paragraphe>Les étudiants ayant obtenu une mention peuvent raisonnablement espérer obtenir une bourse par divers biais pour continuer en thèse.</paragraphe>
		</poursuites>
	</parcours>
</master>