<?xml version="1.0" encoding="UTF-8"?>
<?xml-stylesheet href="../xsl/master.xsl" type="text/xsl" media="screen"?>
<!DOCTYPE masterInfo SYSTEM "../dtd/master.dtd">

<master>
	<parcours annee="INF">
		<presentation>
			<refprof id="nicola.olivetti"/>
			<lieu>
				<campus>Campus de Saint-Jérôme</campus>
			</lieu>
			<description>
				<paragraphe>L’objectif est d’approfondir les connaissances de bases en Informatique sur l’intelligence artificielle, les systèmes d’information, conception et vérification des systèmes, informatique décisionnelle.</paragraphe>
			</description>
		</presentation>
		<competences>
			<paragraphe>Les compétences relèvent des thématiques de recherche suivantes : Fondements Logiques et Algorithmiques ; Fondements de programmation par contraintes et satisfiabilité ; Représentation des connaissances : approfondissement et applications ; Planification, configuration et raisonnement temporel et spatial ; Agents et ontologies pour les systèmes d’information et le web sémantique ; Approches avancées de conception de systèmes d’information ; Extraction et intégration d'information du web ; Web services ; Aide à la décision ; Formalismes à événements discrets.</paragraphe>
		</competences>
		<connaissances>
			<paragraphe>Aptitude à la recherche et à la veille technologique.</paragraphe>
		</connaissances>
		<programme semestre="3">
			<paquet_unites>
				<nom>Unités obligatoires</nom>
				<refunite id="ENSISCU20"/>
			</paquet_unites>
			<paquet_unites>
				<nom>15 crédits à choisir parmi</nom>
				<refunite id="ENSISCU21"/>
				<refunite id="ENSISCU22"/>
				<refunite id="ENSISCU23"/>
				<refunite id="ENSISCU24"/>
				<refunite id="ENSISCU25"/>
				<refunite id="ENSISCU26"/>
				<refunite id="ENSISCU27"/>
				<refunite id="ENSISCU28"/>
				<refunite id="ENSISCU29"/>
				<refunite id="ENSISCU30"/>
				<refunite id="ENSISCU31"/>
				<refunite id="ENSISCU32"/>
			</paquet_unites>
			<paquet_unites>
				<nom>9 crédits à choisir parmi </nom>
				<refunite id="ENSISCU1"/>
				<refunite id="ENSISCU4"/>
				<refunite id="ENSISCU5"/>
				<refunite id="ENSISCU6"/>
				<refunite id="ENSISCU7"/>
				<refunite id="ENSISCU8"/>
				<refunite id="ENSISCU55"/>
				<refunite id="ENSISCU3"/>
				<refunite id="ENSISCU2"/>
				<refunite id="ENSISCU33"/>
				<refunite id="ENSISCU34"/>
				<refunite id="ENSISCU35"/>
				<refunite id="ENSISCU36"/>
				<refunite id="ENSISCU37"/>
				<refunite id="ENSISCU38"/>
				<refunite id="ENSISCU39"/>
				<refunite id="ENSISCU40"/>
				<refunite id="ENSISCU41"/>
				<refunite id="ENSISCU42"/>
				<refunite id="ENSISCU43"/>
				<refunite id="ENSISCU44"/>
				<refunite id="ENSISCU45"/>
				<refunite id="ENSISCU46"/>
				<refunite id="ENSISCU21"/>
				<refunite id="ENSISCU22"/>
				<refunite id="ENSISCU23"/>
				<refunite id="ENSISCU24"/>
				<refunite id="ENSISCU25"/>
				<refunite id="ENSISCU26"/>
				<refunite id="ENSISCU27"/>
				<refunite id="ENSISCU28"/>
				<refunite id="ENSISCU29"/>
				<refunite id="ENSISCU30"/>
				<refunite id="ENSISCU32"/>
				<refunite id="ENSISCU31"/>
			</paquet_unites>
		</programme>
		<programme semestre="4">
			<paquet_unites>
				<nom>Unités obligatoires</nom>
				<refunite id="ENSISDU3"/>
				<refunite id="ENSISDU4"/>
			</paquet_unites>
		</programme>
		<politique_des_stages>
			<paragraphe>Stage de recherche en laboratoire de 4 mois précédé par une étude bibliographique.</paragraphe>
		</politique_des_stages>
		<aspects_formation>
			<paragraphe>Cette spécialité est adossée au Laboratoire des Sciences de l’Information et des Systèmes (LSIS, UMR CNRS 6168) et aborde les thèmes de recherche développés dans les trois pôles de ce laboratoire : informatique, systèmes et image. Ce laboratoire met à disposition des étudiants, toutes ses thématiques scientifiques lors de la formation disciplinaires du S3 et accueille les étudiants pour leur stage du S4.</paragraphe>
		</aspects_formation>
		<conditions_admission>
			<paragraphe>Admission sur dossier.</paragraphe>
			<lien link="http://masterinfo.univ-mrs.fr/candidature/">Déposer une candidature pour 2014/2015.</lien>
		</conditions_admission>
		<debouches>
			<liste>
				<paragraphe>Enseignants, Chercheurs et ingénieurs de recherche, experts, chef de projets R&#38;D en :</paragraphe>
				<el>systèmes d'information,</el>
				<el>intelligence artificielle,</el>
				<el>génie logiciel,</el>
				<el>imagerie numérique.</el>
			</liste>
		</debouches>
		<poursuites>
			<paragraphe>Doctorat dans les domaines de l'Informatique et de l'Imagerie Numérique.</paragraphe>
		</poursuites>
	</parcours>
</master>